{
  "$schema": "../task.schema.json",
  "metadata": {
    "task_id": 529,
    "metaclass": "daily-life",
    "class": "shopping-delivery",
    "description": "On the King Arthur Baking website, purchase a Sourdough Starter Kit, select standard size, and complete checkout",
    "sites_involved": [
      "kingarthurbaking.com"
    ],
    "platform": "king-arthur-baking",
    "common_info": {
      "email_credentials": "credentials to use the assigned disposable email account",
      "user_info": "alex_green_personal_info.json; the dummy user's personal information",
      "user_resume": "PDF resume with disposable email account injected"
    }
  },
  "instruction": "On the King Arthur Baking website, purchase a Sourdough Starter Kit, select standard size, and complete checkout",
  "eval_schema": {
    "url_pattern": "__PLACEHOLDER_WILL_NOT_MATCH__",
    "method": "POST"
  },
  "time_limit": 30,
  "extra_info": []
}
