{
  "$schema": "../task.schema.json",
  "metadata": {
    "task_id": 501,
    "metaclass": "creation-init",
    "class": "general",
    "description": "Create an Asana portfolio \"Research Projects 2026\" with 3 sub-projects",
    "sites_involved": [
      "app.asana.com"
    ],
    "platform": "asana",
    "common_info": {
      "email_credentials": "credentials to use the assigned disposable email account",
      "user_info": "alex_green_personal_info.json; the dummy user's personal information",
      "user_resume": "PDF resume with disposable email account injected"
    }
  },
  "instruction": "Create an Asana portfolio \"Research Projects 2026\" with 3 sub-projects",
  "eval_schema": {
    "url_pattern": "app\\.asana\\.com/app/asana/-/report_execution_context_activity",
    "method": "POST",
    "body": {
      "context_identifier": "PotGridRoot"
    }
  },
  "time_limit": 30,
  "extra_info": [
    {
      "path": "extra_info/project_description.json",
      "description": "Project description with scope, budget, and requirements"
    }
  ]
}
