{
  "$schema": "../task.schema.json",
  "metadata": {
    "task_id": 486,
    "metaclass": "creation-init",
    "class": "general",
    "description": "Create a Mailchimp email campaign with audience set to research newsletter",
    "sites_involved": [
      "mailchimp.com"
    ],
    "platform": "mailchimp",
    "common_info": {
      "email_credentials": "credentials to use the assigned disposable email account",
      "user_info": "alex_green_personal_info.json; the dummy user's personal information",
      "user_resume": "PDF resume with disposable email account injected"
    }
  },
  "instruction": "Create a Mailchimp email campaign with audience set to research newsletter",
  "eval_schema": {
    "url_pattern": "admin\\.mailchimp\\.com/campaigns/(wizard|send|schedule)",
    "method": "POST"
  },
  "time_limit": 30,
  "extra_info": [
    {
      "path": "extra_info/content.json",
      "description": "Content and links for the task"
    }
  ]
}
