{
  "$schema": "../task.schema.json",
  "metadata": {
    "task_id": 41,
    "metaclass": "daily-life",
    "class": "pets",
    "description": "Book daytime dog walking service on Rover for Monday through Friday next week, large dog (Golden Retriever)",
    "sites_involved": [
      "rover.com"
    ],
    "platform": "rover",
    "common_info": {
      "email_credentials": "credentials to use the assigned disposable email account",
      "user_info": "alex_green_personal_info.json; the dummy user's personal information",
      "user_resume": "PDF resume with disposable email account injected"
    }
  },
  "instruction": "Book daytime dog walking service on Rover for Monday through Friday next week, large dog (Golden Retriever)",
  "eval_schema": {
    "url_pattern": "rover\\.com/api/v7/people/.+/services/dog-walking/contactability",
    "method": "POST"
  },
  "time_limit": 30,
  "extra_info": []
}
