{
  "$schema": "../task.schema.json",
  "metadata": {
    "task_id": 799,
    "metaclass": "pet-animal-care",
    "class": "pet-insurance",
    "description": "On ASPCA Pet Health Insurance, get a quote for a 2-year-old cat by entering breed, age, and ZIP code, then select a plan and enroll",
    "sites_involved": [
      "aspcapetinsurance.com"
    ],
    "platform": "aspca-pet-health-insurance",
    "common_info": {
      "email_credentials": "credentials to use the assigned disposable email account",
      "user_info": "alex_green_personal_info.json; the dummy user's personal information",
      "user_resume": "PDF resume with disposable email account injected"
    }
  },
  "instruction": "On ASPCA Pet Health Insurance, get a quote for a 2-year-old cat by entering breed, age, and ZIP code, then select a plan and enroll",
  "eval_schema": {
    "url_pattern": "__PLACEHOLDER_WILL_NOT_MATCH__",
    "method": "POST"
  },
  "time_limit": 30,
  "extra_info": []
}
