{
  "$schema": "../task.schema.json",
  "metadata": {
    "task_id": 265,
    "metaclass": "education-learning",
    "class": "general",
    "description": "On Coursera, enroll in the \"Deep Learning Specialization\" by reaching the checkout or payment page with enrollment details filled in.",
    "sites_involved": [
      "coursera.org"
    ],
    "platform": "coursera",
    "common_info": {
      "email_credentials": "credentials to use the assigned disposable email account",
      "user_info": "alex_green_personal_info.json; the dummy user's personal information",
      "user_resume": "PDF resume with disposable email account injected"
    }
  },
  "instruction": "On Coursera, enroll in the \"Deep Learning Specialization\" by reaching the checkout or payment page with enrollment details filled in.",
  "eval_schema": {
    "url_pattern": "coursera\\.org/api/subscriptions\\.v1/\\?action=createCart",
    "method": "POST"
  },
  "time_limit": 30,
  "extra_info": []
}
