{
  "$schema": "../task.schema.json",
  "metadata": {
    "task_id": 413,
    "metaclass": "personal-management",
    "class": "personal-tools",
    "description": "Create project \"Q2 Engineering Goals\" with 8 tasks, due dates, and priorities in Todoist",
    "sites_involved": [
      "todoist.com"
    ],
    "platform": "todoist",
    "common_info": {
      "email_credentials": "credentials to use the assigned disposable email account",
      "user_info": "alex_green_personal_info.json; the dummy user's personal information",
      "user_resume": "PDF resume with disposable email account injected"
    }
  },
  "instruction": "Create project \"Q2 Engineering Goals\" with 8 tasks, due dates, and priorities in Todoist",
  "eval_schema": {
    "url_pattern": "app\\.todoist\\.com/api/v1/sync",
    "method": "POST"
  },
  "time_limit": 30,
  "extra_info": [
    {
      "path": "extra_info/task_list.json",
      "description": "Task list with names, assignees, due dates, and priorities"
    }
  ]
}
