{
  "$schema": "../task.schema.json",
  "metadata": {
    "task_id": 565,
    "metaclass": "job-search-hr",
    "class": "job-apply",
    "description": "Create a job seeker profile on Jopwell, fill in education background and career interests, and apply to a diversity fellowship program",
    "sites_involved": [
      "jopwell.com"
    ],
    "platform": "jopwell",
    "common_info": {
      "email_credentials": "credentials to use the assigned disposable email account",
      "user_info": "alex_green_personal_info.json; the dummy user's personal information",
      "user_resume": "PDF resume with disposable email account injected"
    }
  },
  "instruction": "Create a job seeker profile on Jopwell, fill in education background and career interests, and apply to a diversity fellowship program",
  "eval_schema": {
    "url_pattern": "platform\\.aboveboard\\.com/api/v1/(users|profile|applications|fellowship)",
    "method": "POST"
  },
  "time_limit": 30,
  "extra_info": []
}
