{
  "$schema": "../task.schema.json",
  "metadata": {
    "task_id": 711,
    "metaclass": "creation-init",
    "class": "color-design",
    "description": "On Coolors, generate a 5-color palette, lock one color and adjust it to #FF6B6B, then export the palette to PDF.",
    "sites_involved": [
      "coolors.co"
    ],
    "platform": "coolors",
    "common_info": {
      "email_credentials": "credentials to use the assigned disposable email account",
      "user_info": "alex_green_personal_info.json; the dummy user's personal information",
      "user_resume": "PDF resume with disposable email account injected"
    }
  },
  "instruction": "On Coolors, generate a 5-color palette, lock one color and adjust it to #FF6B6B, then export the palette to PDF.",
  "eval_schema": {
    "url_pattern": "coolors\\.co/ajax/export-palette",
    "method": "POST"
  },
  "time_limit": 30,
  "extra_info": []
}
