{
  "$schema": "../task.schema.json",
  "metadata": {
    "task_id": 566,
    "metaclass": "job-search-hr",
    "class": "job-apply",
    "description": "Register an employer account on ZipRecruiter, post a Software Engineer job listing with salary range and location",
    "sites_involved": [
      "ziprecruiter.com"
    ],
    "platform": "ziprecruiter",
    "common_info": {
      "email_credentials": "credentials to use the assigned disposable email account",
      "user_info": "alex_green_personal_info.json; the dummy user's personal information",
      "user_resume": "PDF resume with disposable email account injected"
    }
  },
  "instruction": "Register an employer account on ZipRecruiter, post a Software Engineer job listing with salary range and location",
  "eval_schema": {
    "url_pattern": "ziprecruiter\\.com/quiz/create",
    "method": "POST"
  },
  "time_limit": 30,
  "extra_info": [
    {
      "path": "extra_info/listing_details.json",
      "description": "Sublet listing details including description, amenities, and photos"
    }
  ]
}
