{
  "$schema": "../task.schema.json",
  "metadata": {
    "task_id": 812,
    "metaclass": "pet-animal-care",
    "class": "pet-subscription",
    "description": "Complete dog profile on Ollie and subscribe to a custom fresh food meal plan",
    "sites_involved": [
      "myollie.com"
    ],
    "platform": "ollie",
    "common_info": {
      "email_credentials": "credentials to use the assigned disposable email account",
      "user_info": "alex_green_personal_info.json; the dummy user's personal information",
      "user_resume": "PDF resume with disposable email account injected"
    }
  },
  "instruction": "Complete dog profile on Ollie and subscribe to a custom fresh food meal plan",
  "eval_schema": {
    "url_pattern": "__PLACEHOLDER_WILL_NOT_MATCH__",
    "method": "POST"
  },
  "time_limit": 30,
  "extra_info": []
}
