{
  "$schema": "../task.schema.json",
  "metadata": {
    "task_id": 878,
    "metaclass": "travel",
    "class": "outdoor",
    "description": "On Ontario Parks, reserve a waterfront campsite at Algonquin Provincial Park (Canisbay Lake campground) for 3 nights, arriving the upcoming Friday, filter for electric hookup sites",
    "sites_involved": [
      "reservations.ontarioparks.ca"
    ],
    "platform": "ontario-parks",
    "common_info": {
      "email_credentials": "credentials to use the assigned disposable email account",
      "user_info": "alex_green_personal_info.json; the dummy user's personal information",
      "user_resume": "PDF resume with disposable email account injected"
    }
  },
  "instruction": "On Ontario Parks, reserve a waterfront campsite at Algonquin Provincial Park (Canisbay Lake campground) for 3 nights, arriving the upcoming Friday, filter for electric hookup sites",
  "eval_schema": {
    "url_pattern": "__PLACEHOLDER_WILL_NOT_MATCH__",
    "method": "POST"
  },
  "time_limit": 30,
  "extra_info": []
}
