{
  "$schema": "../task.schema.json",
  "metadata": {
    "task_id": 864,
    "metaclass": "entertainment-hobbies",
    "class": "show-tickets",
    "description": "On Ticketmaster Canada, purchase 2 tickets to the next available concert at Scotiabank Arena in Toronto, select seats in the lower bowl (sections 100–120), preferring center-stage view",
    "sites_involved": [
      "ticketmaster.ca"
    ],
    "platform": "ticketmaster",
    "common_info": {
      "email_credentials": "credentials to use the assigned disposable email account",
      "user_info": "alex_green_personal_info.json; the dummy user's personal information",
      "user_resume": "PDF resume with disposable email account injected"
    }
  },
  "instruction": "On Ticketmaster Canada, purchase 2 tickets to the next available concert at Scotiabank Arena in Toronto, select seats in the lower bowl (sections 100–120), preferring center-stage view",
  "eval_schema": {
    "url_pattern": "__PLACEHOLDER_WILL_NOT_MATCH__",
    "method": "POST"
  },
  "time_limit": 30,
  "extra_info": []
}
