{
  "$schema": "../task.schema.json",
  "metadata": {
    "task_id": 35,
    "metaclass": "daily-life",
    "class": "health-medical",
    "description": "Sign up on BetterHelp, book a counseling session, and complete the initial questionnaire",
    "sites_involved": [
      "betterhelp.com"
    ],
    "platform": "betterhelp",
    "common_info": {
      "email_credentials": "credentials to use the assigned disposable email account",
      "user_info": "alex_green_personal_info.json; the dummy user's personal information",
      "user_resume": "PDF resume with disposable email account injected"
    }
  },
  "instruction": "Sign up on BetterHelp, book a counseling session, and complete the initial questionnaire",
  "eval_schema": {
    "url_pattern": "betterhelp\\.com/api/ai-quiz/submit-summary",
    "method": "POST"
  },
  "time_limit": 30,
  "extra_info": []
}
