{
  "$schema": "../task.schema.json",
  "metadata": {
    "task_id": 788,
    "metaclass": "beauty-personal-care",
    "class": "makeup",
    "description": "Complete the skin type quiz on The Ordinary and add the two recommended products to cart",
    "sites_involved": [
      "theordinary.com"
    ],
    "platform": "the-ordinary",
    "common_info": {
      "email_credentials": "credentials to use the assigned disposable email account",
      "user_info": "alex_green_personal_info.json; the dummy user's personal information",
      "user_resume": "PDF resume with disposable email account injected"
    }
  },
  "instruction": "Complete the skin type quiz on The Ordinary and add the two recommended products to cart",
  "eval_schema": {
    "url_pattern": "__PLACEHOLDER_WILL_NOT_MATCH__",
    "method": "POST"
  },
  "time_limit": 30,
  "extra_info": []
}
